{
  "name": "bugfender",
  "displayName": "Bugfender",
  "version": "1.0.0",
  "description": "Investigate Bugfender apps and set up Bugfender SDKs.",
  "author": {
    "name": "Bugfender",
    "url": "https://bugfender.com/"
  },
  "homepage": "https://bugfender.com/",
  "repository": "https://github.com/bugfender/bugfender-skills",
  "license": "Apache-2.0",
  "keywords": [
    "bugfender",
    "observability",
    "logs",
    "crashes",
    "issues",
    "sdk"
  ],
  "skills": "./skills/",
  "mcpServers": "./.mcp.json",
  "metadata": {
    "company": "Bugfender",
    "longDescription": "Connects Claude to Bugfender's hosted MCP service to investigate logs, crashes, issues, feedback, devices, and regressions, and guides repository-aware Bugfender SDK setup."
  }
}
